{
  "$schema": "https://json-schema.org/draft/2020-12/schema",
  "$id": "https://example.local/ml-platform-study/contracts/run-manifest.schema.json",
  "title": "Universal Run Manifest",
  "type": "object",
  "additionalProperties": false,
  "required": [
    "schema_version",
    "run_id",
    "owner",
    "project",
    "environment",
    "timestamps",
    "correlation",
    "code",
    "images",
    "artifacts",
    "model",
    "reproducibility",
    "parameters",
    "metrics",
    "evaluation_results",
    "policy_decisions",
    "approval",
    "lineage_events",
    "retention"
  ],
  "properties": {
    "schema_version": {
      "type": "string",
      "pattern": "^1\\.0\\.0$"
    },
    "run_id": {
      "$ref": "#/$defs/runId"
    },
    "owner": {
      "$ref": "#/$defs/portableName"
    },
    "project": {
      "$ref": "#/$defs/portableName"
    },
    "environment": {
      "$ref": "#/$defs/portableName"
    },
    "parent_run_id": {
      "type": ["string", "null"],
      "pattern": "^run-\\d{8}t\\d{6}z-[0-9a-f]{8}$"
    },
    "timestamps": {
      "type": "object",
      "additionalProperties": false,
      "required": ["started_at", "finished_at"],
      "properties": {
        "started_at": {
          "$ref": "#/$defs/isoTimestamp"
        },
        "finished_at": {
          "$ref": "#/$defs/isoTimestamp"
        }
      }
    },
    "correlation": {
      "type": "object",
      "additionalProperties": false,
      "required": ["trace_id", "correlation_id"],
      "properties": {
        "trace_id": {
          "$ref": "#/$defs/hexId"
        },
        "correlation_id": {
          "$ref": "#/$defs/portableId"
        }
      }
    },
    "code": {
      "type": "object",
      "additionalProperties": false,
      "required": ["repository", "commit", "dirty_worktree", "dependency_lockfile_hash"],
      "properties": {
        "repository": {
          "type": "string",
          "pattern": "^https://github\\.com/[a-zA-Z0-9_.-]+/[a-zA-Z0-9_.-]+$"
        },
        "commit": {
          "type": "string",
          "pattern": "^[0-9a-f]{40}$"
        },
        "dirty_worktree": {
          "type": "boolean"
        },
        "dependency_lockfile_hash": {
          "$ref": "#/$defs/sha256"
        }
      }
    },
    "images": {
      "type": "object",
      "additionalProperties": false,
      "required": ["source", "output"],
      "properties": {
        "source": {
          "$ref": "#/$defs/imageRef"
        },
        "output": {
          "$ref": "#/$defs/imageRef"
        }
      }
    },
    "artifacts": {
      "type": "object",
      "additionalProperties": false,
      "required": ["inputs", "outputs"],
      "properties": {
        "inputs": {
          "type": "array",
          "minItems": 1,
          "items": {
            "$ref": "#/$defs/artifact"
          }
        },
        "outputs": {
          "type": "array",
          "minItems": 1,
          "items": {
            "$ref": "#/$defs/artifact"
          }
        }
      }
    },
    "model": {
      "type": "object",
      "additionalProperties": false,
      "required": ["name", "version", "license"],
      "properties": {
        "name": {
          "$ref": "#/$defs/portableName"
        },
        "version": {
          "$ref": "#/$defs/semanticVersion"
        },
        "license": {
          "type": "string",
          "minLength": 3
        },
        "tokenizer": {
          "type": ["string", "null"]
        },
        "embedding_model": {
          "type": ["string", "null"]
        },
        "prompt_version": {
          "type": ["string", "null"]
        },
        "index_version": {
          "type": ["string", "null"]
        }
      }
    },
    "reproducibility": {
      "type": "object",
      "additionalProperties": false,
      "required": ["hardware", "driver_runtime_versions", "random_seeds"],
      "properties": {
        "hardware": {
          "type": "object",
          "additionalProperties": false,
          "required": ["cpu", "memory_gib", "gpu"],
          "properties": {
            "cpu": {
              "type": "string",
              "minLength": 3
            },
            "memory_gib": {
              "type": "number"
            },
            "gpu": {
              "type": ["string", "null"]
            }
          }
        },
        "driver_runtime_versions": {
          "type": "object",
          "additionalProperties": {
            "type": "string",
            "minLength": 1
          }
        },
        "random_seeds": {
          "type": "object",
          "additionalProperties": {
            "type": "integer"
          }
        }
      }
    },
    "parameters": {
      "type": "object"
    },
    "metrics": {
      "type": "object",
      "additionalProperties": {
        "type": "number"
      }
    },
    "evaluation_results": {
      "type": "array",
      "items": {
        "$ref": "#/$defs/evaluationResult"
      }
    },
    "policy_decisions": {
      "type": "array",
      "items": {
        "$ref": "#/$defs/policyDecision"
      }
    },
    "approval": {
      "type": "object",
      "additionalProperties": false,
      "required": ["required", "approved_by", "approved_at"],
      "properties": {
        "required": {
          "type": "boolean"
        },
        "approved_by": {
          "type": ["string", "null"]
        },
        "approved_at": {
          "type": ["string", "null"],
          "pattern": "^\\d{4}-\\d{2}-\\d{2}T\\d{2}:\\d{2}:\\d{2}Z$"
        }
      }
    },
    "lineage_events": {
      "type": "array",
      "items": {
        "$ref": "#/$defs/lineageEvent"
      }
    },
    "retention": {
      "type": "object",
      "additionalProperties": false,
      "required": ["security_classification", "retain_until"],
      "properties": {
        "security_classification": {
          "type": "string",
          "enum": ["public", "internal", "confidential", "restricted"]
        },
        "retain_until": {
          "$ref": "#/$defs/date"
        }
      }
    }
  },
  "$defs": {
    "portableName": {
      "type": "string",
      "minLength": 3,
      "maxLength": 63,
      "pattern": "^(?!.*(?:password|passwd|secret|token|credential|apikey|api-key|email|user|konrad))[a-z0-9]([-a-z0-9]*[a-z0-9])?$"
    },
    "portableId": {
      "type": "string",
      "minLength": 3,
      "maxLength": 128,
      "pattern": "^[a-z0-9]([-a-z0-9]*[a-z0-9])?$"
    },
    "runId": {
      "type": "string",
      "pattern": "^run-\\d{8}t\\d{6}z-[0-9a-f]{8}$"
    },
    "semanticVersion": {
      "type": "string",
      "pattern": "^\\d+\\.\\d+\\.\\d+$"
    },
    "isoTimestamp": {
      "type": "string",
      "pattern": "^\\d{4}-\\d{2}-\\d{2}T\\d{2}:\\d{2}:\\d{2}Z$"
    },
    "date": {
      "type": "string",
      "pattern": "^\\d{4}-\\d{2}-\\d{2}$"
    },
    "hexId": {
      "type": "string",
      "pattern": "^[0-9a-f]{16,32}$"
    },
    "sha256": {
      "type": "string",
      "pattern": "^sha256:[0-9a-f]{64}$"
    },
    "uri": {
      "type": "string",
      "minLength": 3,
      "pattern": "^(s3|file|https)://[^\\s]+$"
    },
    "imageRef": {
      "type": "object",
      "additionalProperties": false,
      "required": ["repository", "tag", "digest", "sbom", "signature"],
      "properties": {
        "repository": {
          "type": "string",
          "minLength": 3
        },
        "tag": {
          "type": "string",
          "minLength": 1
        },
        "digest": {
          "$ref": "#/$defs/sha256"
        },
        "sbom": {
          "$ref": "#/$defs/uri"
        },
        "signature": {
          "$ref": "#/$defs/uri"
        }
      }
    },
    "artifact": {
      "type": "object",
      "additionalProperties": false,
      "required": ["name", "kind", "uri", "checksum", "schema_ref", "data_revision"],
      "properties": {
        "name": {
          "$ref": "#/$defs/portableName"
        },
        "kind": {
          "type": "string",
          "enum": ["dataset", "model", "report", "metric", "index", "artifact"]
        },
        "uri": {
          "$ref": "#/$defs/uri"
        },
        "checksum": {
          "$ref": "#/$defs/sha256"
        },
        "schema_ref": {
          "$ref": "#/$defs/uri"
        },
        "data_revision": {
          "type": "object",
          "additionalProperties": false,
          "required": ["type", "id"],
          "properties": {
            "type": {
              "type": "string",
              "enum": ["lakefs-commit", "table-snapshot", "git-commit", "object-version"]
            },
            "id": {
              "type": "string",
              "minLength": 3
            }
          }
        }
      }
    },
    "evaluationResult": {
      "type": "object",
      "additionalProperties": false,
      "required": ["name", "metric", "value", "unit", "threshold", "passed"],
      "properties": {
        "name": {
          "$ref": "#/$defs/portableName"
        },
        "metric": {
          "$ref": "#/$defs/portableName"
        },
        "value": {
          "type": "number"
        },
        "unit": {
          "type": "string",
          "minLength": 1
        },
        "threshold": {
          "type": "string",
          "minLength": 1
        },
        "passed": {
          "type": "boolean"
        }
      }
    },
    "policyDecision": {
      "type": "object",
      "additionalProperties": false,
      "required": ["name", "decision", "reason"],
      "properties": {
        "name": {
          "$ref": "#/$defs/portableName"
        },
        "decision": {
          "type": "string",
          "enum": ["allow", "warn", "deny"]
        },
        "reason": {
          "type": "string",
          "minLength": 1
        }
      }
    },
    "lineageEvent": {
      "type": "object",
      "additionalProperties": false,
      "required": ["event_type", "event_time", "source", "target"],
      "properties": {
        "event_type": {
          "$ref": "#/$defs/portableName"
        },
        "event_time": {
          "$ref": "#/$defs/isoTimestamp"
        },
        "source": {
          "$ref": "#/$defs/uri"
        },
        "target": {
          "$ref": "#/$defs/uri"
        }
      }
    }
  }
}
